"Summarizing Long-Length Videos with GAN-Enhanced Audio/Visual Features","H. Lee; G. Lee","Seoul National University of Science and Technology, Republic of Korea; Seoul National University of Science and Technology, Republic of Korea","2019 IEEE/CVF International Conference on Computer Vision Workshop (ICCVW)","5 Mar 2020","2019","","","3727","3731","In this paper, we propose a novel supervised method for summarizing long-length videos. Many recent works presented successful results in video summarization. However, most videos in those works are short in duration (~5 minutes), and the methods often break down on very long videos (~30 minutes). Moreover, most works only use visual features, while audios provide useful features for the task. Based on these observations, we present a model that exploits both visual and audio features. To handle long videos, our model also refines the extracted features using adversarial networks. To demonstrate our model, we have collected a new dataset of 63 e-sports (~30 minutes) videos, each accompanied by an editorial summary video that is about 10% in length of the original video. Evaluation on this dataset suggests that our method produces quality summaries for very long videos.","2473-9944","978-1-7281-5023-9","10.1109/ICCVW.2019.00462","","https://ieeexplore.ieee.org/stamp/stamp.jsp?arnumber=9022347","Summarization;GAN;Audio;Video;Multimodal","Videos;Feature extraction;Visualization;Task analysis;Mel frequency cepstral coefficient;Benchmark testing;Gallium nitride","audio signal processing;feature extraction;sport;video signal processing","long-length videos;supervised method;video summarization;audio features;editorial summary video;visual features;feature extraction;adversarial networks;e-sports","","","","16","","5 Mar 2020","","","IEEE","IEEE Conferences"
"Research and Implementation of ASOC Audio Driver Model on the Blackfin Platform","Q. Wang; L. Zhao; X. Han","Shenyang Univ. of Chem. Technol., Shenyang, China; Shenyang Univ. of Chem. Technol., Shenyang, China; Shenyang Univ. of Chem. Technol., Shenyang, China","2012 Second International Conference on Intelligent System Design and Engineering Application","3 Apr 2012","2012","","","720","723","The development of Audio driver is very important in embed audio system, which decides the performance of audio system directly. WM8731 audio driver is implemented on uclinux embedded operating system by using ASOC driver model in this paper. And in the design, combining the characteristics of Blackfin561 and uclinux sufficiently. To achieve the demand of real time characteristic by using the techniques of interrupt, DMA and Circle buffer storage, the performance of system is enhanced. Audio driver procedure in this paper is proved steady and reliable after many tests.","","978-1-4577-2120-5","10.1109/ISdea.2012.672","","https://ieeexplore.ieee.org/stamp/stamp.jsp?arnumber=6173307","ASOC audio driver;Interrupt;DMA;Circle buffer storage","Phase change materials;Buffer storage;Codecs;Audio systems;Kernel;Linux;Hardware","audio signal processing;system-on-chip","ASOC audio driver model;blackfin platform;embedded audio system;WM8731 audio driver;uclinux embedded operating system;Blackfin561 characteristics","","","","6","","3 Apr 2012","","","IEEE","IEEE Conferences"
"Normalization of LPC residue for random access frame in audio coding","H. Shu; R. Yu; H. Huang; S. Rahardja","Institute for Infocomm Research, Agency for Science, Technology & Research, Singapore 138632; Institute for Infocomm Research, Agency for Science, Technology & Research, Singapore 138632; Institute for Infocomm Research, Agency for Science, Technology & Research, Singapore 138632; Institute for Infocomm Research, Agency for Science, Technology & Research, Singapore 138632","2011 IEEE Workshop on Applications of Signal Processing to Audio and Acoustics (WASPAA)","17 Nov 2011","2011","","","265","268","In a time-domain audio codec system, linear prediction is typically used as a tool to predict the value of future samples based on the value of previous samples. Such tool is useful to remove redundancy in the signal so that the signal can be more efficiently coded by an entropy coder. Modern digital audio system requires random access capability and because of this requirement, the residue produced by the predictor exhibits a high dynamic range. In this paper, an adaptive normalization scheme is proposed to reduce the energy level of first few prediction residues in random access blocks. This enhances the coding efficiency of the entropy coding. The proposed scheme can be used in speech/audio analysis and synthesis.","1947-1629","978-1-4577-0693-6","10.1109/ASPAA.2011.6082272","","https://ieeexplore.ieee.org/stamp/stamp.jsp?arnumber=6082272","Linear Predictive Coding (LPC);Audio Coding;Random Access;Normalization","Entropy;Audio coding;Acoustics;Energy states;Indexes;Conferences","audio coding;entropy codes;linear predictive coding;speech codecs;speech coding;speech synthesis;time-domain analysis","time-domain analysis;audio codec system;entropy code;digital audio system;adaptive normalization scheme;random access blocks;audio coding;speech synthesis;LPC residue;linear predictive coding","","1","","7","","17 Nov 2011","","","IEEE","IEEE Conferences"
"Optimal frequency characteristics of a car audio system under the traveling noise","M. Tsuruta-Hamamura; T. Hidaka; H. Hasegawa","Utsunomiya University, Graduate school of engineering, Utsunomiya, Japan; Utsunomiya University, Graduate school of engineering, Utsunomiya, Japan; Utsunomiya University, Graduate school of engineering, Utsunomiya, Japan","2018 International Workshop on Advanced Image Technology (IWAIT)","31 May 2018","2018","","","1","3","To improve the car audio system that affects the evaluation of comfortability of a vehicle, the subjective evaluation of music reproduced from the car audio system was conducted with or without car interior noise. As a result, the sound stimuli enhanced low frequency by -6 dB/oct. was most suitable for car interior comfortability with and without noise conditions.","","978-1-5386-2615-3","10.1109/IWAIT.2018.8369673","","https://ieeexplore.ieee.org/stamp/stamp.jsp?arnumber=8369673","car audio system;subjective evaluation;frequency characteristics;noise;music","Automobiles;Audio systems;Standards;Safety;Reliability;Engines;Roads","acoustic signal processing;audio systems","optimal frequency characteristics;car audio system;car interior noise;car interior comfortability","","","","2","","31 May 2018","","","IEEE","IEEE Conferences"
"Attentive Fusion Enhanced Audio-Visual Encoding for Transformer Based Robust Speech Recognition","L. Wei; J. Zhang; J. Hou; L. Dai","University of Science and Technology of China (USTC),National Engineering Laboratory for Speech and Language Information Processing,Hefei,Anhui,P. R. China; University of Science and Technology of China (USTC),National Engineering Laboratory for Speech and Language Information Processing,Hefei,Anhui,P. R. China; University of Science and Technology of China (USTC),National Engineering Laboratory for Speech and Language Information Processing,Hefei,Anhui,P. R. China; University of Science and Technology of China (USTC),National Engineering Laboratory for Speech and Language Information Processing,Hefei,Anhui,P. R. China","2020 Asia-Pacific Signal and Information Processing Association Annual Summit and Conference (APSIPA ASC)","31 Dec 2020","2020","","","638","643","Audio-visual information fusion enables a performance improvement in speech recognition performed in complex acoustic scenarios, e.g., noisy environments. It is required to explore an effective audio-visual fusion strategy for audiovisual alignment and modality reliability. Different from the previous end-to-end approaches where the audio-visual fusion is performed after encoding each modality, in this paper we propose to integrate an attentive fusion block into the encoding process. It is shown that the proposed audio-visual fusion method in the encoder module can enrich audio-visual representations, as the relevance between the two modalities is leveraged. In line with the transformer-based architecture, we implement the embedded fusion block using a multi-head attention based audiovisual fusion with one-way or two-way interactions. The proposed method can sufficiently combine the two streams and weaken the over-reliance on the audio modality. Experiments on the LRS3-TED dataset demonstrate that the proposed method can increase the recognition rate by 0.55%, 4.51% and 4.61% on average under the clean, seen and unseen noise conditions, respectively, compared to the state-of-the-art approach.","2640-0103","978-988-14768-8-3","","","https://ieeexplore.ieee.org/stamp/stamp.jsp?arnumber=9306348","","Encoding;Visualization;Speech recognition;Decoding;Training;Speech enhancement;Feature extraction","audio signal processing;audio-visual systems;feature extraction;sensor fusion;speech processing;speech recognition;video signal processing","performance improvement;audio-visual fusion strategy;audio-visual information fusion;transformer based robust speech recognition;fusion enhanced audio-visual encoding;recognition rate;audio modality;audiovisual fusion;multihead attention;embedded fusion block;transformer-based architecture;audio-visual representations;encoder module;audio-visual fusion method;encoding process;attentive fusion block;previous end-to-end approaches;audiovisual alignment","","","","26","","31 Dec 2020","","","IEEE","IEEE Conferences"
"Audio-Visual Speech Enhancement Using Multimodal Deep Convolutional Neural Networks","J. Hou; S. Wang; Y. Lai; Y. Tsao; H. Chang; H. Wang","Research Center for Information Technology Innovation, Taipei, Taiwan; Graduate Institute of Communication Engineering, National Taiwan University, Taipei, Taiwan; Department of Biomedical Engineering, National Yang-Ming University, Taipei, Taiwan; Research Center for Information Technology Innovation, Taipei, Taiwan; Department of Audiology and Speech language pathology, Mackay Medical College, New Taipei City, Taiwan; Institute of Information Science, Academia Sinica, Taipei, Taiwan","IEEE Transactions on Emerging Topics in Computational Intelligence","23 Mar 2018","2018","2","2","117","128","Speech enhancement (SE) aims to reduce noise in speech signals. Most SE techniques focus only on addressing audio information. In this paper, inspired by multimodal learning, which utilizes data from different modalities, and the recent success of convolutional neural networks (CNNs) in SE, we propose an audio-visual deep CNNs (AVDCNN) SE model, which incorporates audio and visual streams into a unified network model. We also propose a multitask learning framework for reconstructing audio and visual signals at the output layer. Precisely speaking, the proposed AVDCNN model is structured as an audio-visual encoder-decoder network, in which audio and visual data are first processed using individual CNNs, and then fused into a joint network to generate enhanced speech (the primary task) and reconstructed images (the secondary task) at the output layer. The model is trained in an endto-end manner, and parameters are jointly learned through back propagation. We evaluate enhanced speech using five instrumental criteria. Results show that the AVDCNN model yields a notably superior performance compared with an audio-only CNN-based SE model and two conventional SE approaches, confirming the effectiveness of integrating visual information into the SE process. In addition, the AVDCNN model also outperforms an existing audio- visual SE model, confirming its capability of effectively combining audio and visual information in SE.","2471-285X","","10.1109/TETCI.2017.2784878","Academia Sinica Thematic Research(grant numbers:AS-105-TP-C02-1); ","https://ieeexplore.ieee.org/stamp/stamp.jsp?arnumber=8323326","Audio-visual systems;deep convolutional neural networks;multimodal learning;speech enhancement","Visualization;Speech;Speech enhancement;Noise measurement;Mouth;Training;Convolutional neural networks","audio coding;audio signal processing;backpropagation;feedforward neural nets;image coding;speech enhancement;speech recognition","audio-visual speech enhancement;multimodal deep convolutional neural networks;speech signals;audio information;multimodal learning;visual streams;unified network model;multitask learning framework;visual signals;output layer;audio-visual encoder-decoder network;visual data;enhanced speech;SE process;audio-visual deep CNN-SE model;AVDCNN model","","40","","87","","23 Mar 2018","","","IEEE","IEEE Journals"
"Audio-watermarking based ownership verification system using enhanced DWT-SVD technique","M. S. Al-Yaman; M. A. Al-Taee; H. A. Alshammas","Computer Engineering Department, The University of Jordan, Amman, Jordan; School of Computing & Information Technology, Kingston University London, London, UK; Computer Engineering Department, The University of Jordan, Amman, Jordan","International Multi-Conference on Systems, Signals & Devices","10 May 2012","2012","","","1","5","Audio watermarking has been proposed as an effective solution to solve or mitigate the new challenges of audio ownership verification. These challenges arose from easiness of copying and distributing of audio applications. This paper proposes important performance enhancements to a previously-reported audio ownership verification system based upon utilizing a combination of Discrete Wavelet Transform (DWT) and Singular Value Decomposition (SVD) techniques. A new audio signal framing, DWT matrix formation and embedding methods are proposed and successfully implemented to improve the minimum audio-cover period, quality of the watermarked audio and its robustness against various attacks. Performance evaluation of the developed system demonstrated improvements of 69% in the required minimum audio-cover period, 25% in the Signal-to-Noise Ratio (SNR), and improved robustness against various watermarking benchmark attacks.","","978-1-4673-1591-3","10.1109/SSD.2012.6198022","","https://ieeexplore.ieee.org/stamp/stamp.jsp?arnumber=6198022","Audio watermarking;ownership verification;audio copyright protection;discrete wavelet transform;singular-value decomposition","Watermarking;Discrete wavelet transforms;Robustness;Signal to noise ratio;Matrix decomposition;Media","audio watermarking;discrete wavelet transforms;singular value decomposition","audio-watermarking based ownership verification system;enhanced DWT-SVD technique;discrete wavelet transform;singular value decomposition;audio signal framing;DWT matrix formation","","13","","13","","10 May 2012","","","IEEE","IEEE Conferences"
"Enhancing Sampling and Counting Method for Audio Retrieval with Time-Stretch Resistance","S. Yao; B. Niu; J. Liu","Taiyuan University of Technology, School of Information and Computer, Taiyuan, China; Taiyuan University of Technology, School of Information and Computer, Taiyuan, China; NEC Corporation, System Platform Research Laboratories, Tokyo, Japan","2018 IEEE Fourth International Conference on Multimedia Big Data (BigMM)","21 Oct 2018","2018","","","1","5","An ideal audio retrieval method should be not only highly efficient in identifying an audio track from a massive audio dataset, but also robust to any distortion. Unfortunately, none of the audio retrieval methods is robust to all types of distortions. An audio retrieval method has to do with both the audio fingerprint and the strategy, especially how they are combined. We argue that the Sampling and Counting Method (SC), a state-of-the-art audio retrieval method, would be promising towards an ideal audio retrieval method, if we could make it robust to time-stretch and pitch-stretch. Towards this objective, this paper proposes a turning point alignment method to enhance SC with resistance to time-stretch, which makes Philips and Philips-like fingerprints resist to time-stretch. Experimental results show that our approach can resist to time-stretch from 70% to 130%, which is on a par to the state-of-the-art methods. It also marginally improves the retrieval performance with various noise distortions.","","978-1-5386-5321-0","10.1109/BigMM.2018.8499068","","https://ieeexplore.ieee.org/stamp/stamp.jsp?arnumber=8499068","audio retrieval;audio fingerprint;fingerprint matching;LSH;time-stretch","Fingerprint recognition;Turning;Distortion;Resistance;Resists;Indexes;Filtering","acoustic signal processing;audio signal processing;information retrieval","time-stretch resistance;ideal audio retrieval method;audio track;massive audio dataset;audio fingerprint;state-of-the-art audio retrieval method;turning point alignment method;state-of-the-art methods;retrieval performance;Sampling and Counting Method;Philips-like fingerprints;noise distortions","","2","","11","","21 Oct 2018","","","IEEE","IEEE Conferences"
"Audio Captioning Based on Combined Audio and Semantic Embeddings","A. Ö. Eren; M. Sert","Başkent University,Department of Computer Engineering,Ankara,Turkey; Başkent University,Department of Computer Engineering,Ankara,Turkey","2020 IEEE International Symposium on Multimedia (ISM)","22 Jan 2021","2020","","","41","48","Audio captioning is a recently proposed task for automatically generating a textual description of a given audio clip. Most existing approaches use the encoder-decoder model without using semantic information. In this study, we propose a bi-directional Gated Recurrent Unit (BiGRU) model based on encoder-decoder architecture using audio and semantic embeddings. To obtain semantic embeddings, we extract subject-verb embeddings using the subjects and verbs from the audio captions. We use a Multilayer Perceptron classifier to predict subject-verb embeddings of test audio clips for the testing stage. Within the aim of extracting audio features, in addition to log Mel energies, we use a pretrained audio neural network (PANN) as a feature extractor which is used for the first time in the audio captioning task to explore the usability of audio embeddings in the audio captioning task. We combine audio embeddings and semantic embeddings to feed the BiGRU-based encoder-decoder model. Following this, we evaluate our model on two audio captioning datasets: Clotho and AudioCaps. Experimental results show that the proposed BiGRU-based deep model significantly outperforms the state of the art results across different evaluation metrics and inclusion of semantic information enhance the captioning performance.","","978-1-7281-8697-9","10.1109/ISM.2020.00014","","https://ieeexplore.ieee.org/stamp/stamp.jsp?arnumber=9327916","audio captioning;PANNs;GRU;BiGRU","Feature extraction;Task analysis;Semantics;Decoding;Birds;Training;Logic gates","audio signal processing;feature extraction;multilayer perceptrons;signal classification;speech recognition;video signal processing","audio clip;semantic information;bi-directional gated recurrent unit model;encoder-decoder architecture;semantic embeddings;subject-verb embeddings;audio features;pretrained audio neural network;BiGRU-based encoder-decoder model;audio captioning datasets;BiGRU-based deep model;combined audio embeddings;textual description;multilayer perceptron classifier;log Mel energies;PANN;feature extractor","","","","33","","22 Jan 2021","","","IEEE","IEEE Conferences"
"Design and Performance Evaluation of Advanced Digital Audio Broadcasting System","M. Baek; B. Lee; K. Yang; S. Beack; M. Lee; G. Shin; K. Kwon; H. Lim","Electron. Telecommun. Res. Inst. (ETRI), Daejeon, South Korea; Electron. Telecommun. Res. Inst. (ETRI), Daejeon, South Korea; Electron. Telecommun. Res. Inst. (ETRI), Daejeon, South Korea; Electron. Telecommun. Res. Inst. (ETRI), Daejeon, South Korea; Kai-media, Daejeon, South Korea; Marueng, Daejeon, South Korea; Korea Electron. Technol. Inst., Seoul, South Korea; Electron. Telecommun. Res. Inst. (ETRI), Daejeon, South Korea","2015 7th International Conference on Multimedia, Computer Graphics and Broadcasting (MulGraB)","21 Mar 2016","2015","","","9","12","DAB is a traditional digital radio broadcasting technology. To enhance the performance and quality of DAB system, DAB+ is standardized with outer coding and superior audio codec (HE-AACv2). Recently, as audio codec technology develops, state of the art audio codec, USAC has been standardized. This paper designs the DAB+ system with USAC to enhance the audio quality and efficiency. USAC can improve the audio quality and efficiency of the digital radio system better than HE-AACv2. This paper describes the design and implementation of digital audio broadcasting system with USAC audio codec based on DAB+ system.","","978-1-4673-9831-2","10.1109/MulGraB.2015.10","","https://ieeexplore.ieee.org/stamp/stamp.jsp?arnumber=7434189","DAB+;USAC","Digital audio broadcasting;Receivers;Codecs;Multiplexing;Encoding","audio coding;digital audio broadcasting;performance evaluation","performance evaluation;advanced digital audio broadcasting system;DAB system;HE-AACv2;DAB+ system;audio quality enhancement;USAC audio codec","","","","6","","21 Mar 2016","","","IEEE","IEEE Conferences"
"A robust audio identification for enhancing audio-based indoor localization","Hye-Seung Cho; Sang-Sun Ko; Hyoung-Gook Kim","Kwangwoon University, Seoul, Rep. of Korea; Kwangwoon University, Seoul, Rep. of Korea; Kwangwoon University, Seoul, Rep. of Korea","2016 IEEE International Conference on Multimedia & Expo Workshops (ICMEW)","26 Sep 2016","2016","","","1","6","Nowadays, user localization in indoor environments is more necessary to build many location-based services. This paper presents a robust audio identification method for enhancing a real-time indoor localization system on a mobile device using the audio signals emitted by nearby loudspeakers. The proposed audio identification method deals with various noise distortions due to different noisy indoor locations by using foreground/background audio separation, prominent spectral pitch-based binary audio fingerprinting, and spectral peak-triplet-based audio fingerprinting. Experimental results confirm that the proposed audio identification method is quite robust in different noise conditions and achieves preliminary promising results for discriminating the location and orientation of a user in large indoor locations.","","978-1-5090-1552-8","10.1109/ICMEW.2016.7574701","","https://ieeexplore.ieee.org/stamp/stamp.jsp?arnumber=7574701","Indoor localization system;Audio fingerprinting;Foreground/background audio separation","Fingerprint recognition;Watermarking;Databases;Robustness;Loudspeakers;Spectrogram;Noise measurement","audio signal processing;loudspeakers;mobile handsets","audio-based indoor localization enhancement;robust audio identification method;user localization;indoor environment;location-based services;mobile device;audio signal;loudspeaker;noise distortion;audio separation;spectral pitch-based binary audio fingerprinting;spectral peak-triplet-based audio fingerprinting","","1","","15","","26 Sep 2016","","","IEEE","IEEE Conferences"
"Peak-Based Philips Fingerprint Robust To Pitch-Shift For Massive Audio Retrieval","R. Chu; B. Niu; S. Yao; J. Liu","School of Information and Computer, Taiyuan University of Technology, Taiyuan, China; School of Information and Computer, Taiyuan University of Technology, Taiyuan, China; Institute of Big Data Science and Industry, Shanxi University, Taiyuan, China; Biometrics Research Laboratories, NEC Corporation, Tokyo, Japan","2019 IEEE Fifth International Conference on Multimedia Big Data (BigMM)","5 Dec 2019","2019","","","314","320","An ideal audio retrieval system identifies a short query snippet from a massive audio database with both robustness and efficiency. Unfortunately, none of the existing systems could robustly handle all distortions while keeping efficient. An efficient audio retrieval method of the systems must match the features of the fingerprint. Enhanced Sampling and Counting method (eSC), the state-of-the-art audio retrieval method, proposed for Philips-like fingerprints, has achieved both high efficiency and strong robustness, featuring time-stretch resistance. We argue that Philips fingerprint, robust to many types of distortions except speed-change which includes time-stretch and pitch-shift, combined with eSC is promising towards an ideal audio retrieval system, if we could make it robust to pitch-shift. To achieve the goal, this paper proposes a peak-point based energy bands computation method (PPEB) to enhance Philips fingerprint (PF) with resistance to pitch-shift, and the resulting fingerprint is called Peak-point based Philips fingerprint (PPF). Experimental results show that PPF can resist pitch-shift ranging from 70% to 130%, while retaining the robustness of PF to various noise distortions.","","978-1-7281-5527-2","10.1109/BigMM.2019.000-3","","https://ieeexplore.ieee.org/stamp/stamp.jsp?arnumber=8919347","audio fingerprint;audio retrieval;pitch shift","Fingerprint recognition;Distortion;Robustness;Resists;Spectrogram;Filtering;GSM","audio databases;audio signal processing;query processing","short query snippet;audio database;time-stretch resistance;peak-point based energy bands computation method;pitch-shift;audio retrieval method;enhanced sampling and counting method;peak-based Philips fingerprint","","1","","14","","5 Dec 2019","","","IEEE","IEEE Conferences"
