"Measuring Audio Processing Latency for Lip-Sync purposes in DSP-based Home Theatre Systems","N. Pekez; R. Čelić; R. Pečkai-Kovač; J. Kovačević","University of Novi Sad, RT-RK R&D Institute for Computer Based Systems,Computer Engineering Department Home Audio DepartmentRT-RK,Novi Sad,Serbia,21000; RT-RK R&D Institute for Computer Based Systems,Home Audio Department,Novi Sad,Serbia,21000; RT-RK R&D Institute for Computer Based Systems,Home Audio Department,Novi Sad,Serbia,21000; University of Novi Sad, RT-RK R&D Institute for Computer Based Systems,Computer Engineering Department Home Audio DepartmentRT-RK,Novi Sad,Serbia,21000","2019 27th Telecommunications Forum (TELFOR)","30 Jan 2020","2019","","","1","4","Higher communication requirements introduced with advances in digital audio have also led to many connectivity and compatibility challenges in consumer electronics (CE). Systems composed of several audio-video, pre-and post-processing components such as Home Theatres (HT) often open up some major issues due to incompatibile processing times between included components. The main such issue is lip-sync error - one of the most disturbing flaws of HT and similar systems from consumers perspective. With announcement of HDMI feature known as Enhanced Audio Return Channel (eARC) utilization of full audio bandwidth and thus processing of HQ object-based audio technologies such as Dolby Atmos and DTS:X is finally possible. However, audio bandwidth magnified by several milions of bits has also increased audio processing latencies and has made even wider gap between audio-video processing times. In order to optmize high memory demands and compensate for delays in the HT system, audio engineers need to precisely measure digital audio processing latencies. This paper proposes a method for the most accurate measurement of digital processing times in DSP-based audio systems.","","978-1-7281-4790-1","10.1109/TELFOR48224.2019.8971274","","https://ieeexplore.ieee.org/stamp/stamp.jsp?arnumber=8971274","dsp;dsp latency;processing delay;home theatre;lip-sync error","","audio signal processing;audio systems;consumer electronics;video signal processing","included components;main such issue;lip-sync error;consumers perspective;Enhanced Audio Return Channel utilization;audio bandwidth;HQ object-based audio technologies;audio-video processing times;HT system;audio engineers;digital audio processing latencies;digital processing times;DSP-based audio systems;lip-sync purposes;higher communication requirements;compatibility challenges;consumer electronics;post-processing components;incompatibile processing times;DSP-based Home theatre systems;DSP-baseD Home Theatre Systems;Enhanced Audio Return Channel utilization","","","","7","","30 Jan 2020","","","IEEE","IEEE Conferences"
"Frequency domain singular value decomposition for efficient spatial audio coding","S. Zamani; T. Nanjundaswamy; K. Rose","Department of Electrical and Computer Engineering, University of California Santa Barbara, CA 93106; Department of Electrical and Computer Engineering, University of California Santa Barbara, CA 93106; Department of Electrical and Computer Engineering, University of California Santa Barbara, CA 93106","2017 IEEE Workshop on Applications of Signal Processing to Audio and Acoustics (WASPAA)","11 Dec 2017","2017","","","126","130","Advances in virtual reality have generated substantial interest in accurately reproducing and storing spatial audio in the higher order ambisonics (HOA) representation, given its rendering flexibility. Recent standardization for HOA compression adopted a framework wherein HOA data are decomposed into principal components that are then encoded by standard audio coding, i.e., frequency domain quantization and entropy coding to exploit psychoacoustic redundancy. A noted shortcoming of this approach is the occasional mismatch in principal components across blocks, and the resulting suboptimal transitions in the data fed to the audio coder. Instead, we propose a framework where singular value decomposition (SVD) is performed after transformation to the frequency domain via the modified discrete cosine transform (MDCT). This framework not only ensures smooth transition across blocks, but also enables frequency dependent SVD for better energy compaction. Moreover, we introduce a novel noise substitution technique to compensate for suppressed ambient energy in discarded higher order ambisonics channels, which significantly enhances the perceptual quality of the reconstructed HOA signal. Objective and subjective evaluation results provide evidence for the effectiveness of the proposed framework in terms of both higher compression gains and better perceptual quality, compared to existing methods.","1947-1629","978-1-5386-1632-1","10.1109/WASPAA.2017.8170008","","https://ieeexplore.ieee.org/stamp/stamp.jsp?arnumber=8170008","Higher Order Ambisonics;spatial audio coding;audio compression;3D audio","Transform coding;Codecs;Frequency-domain analysis;Transforms;Quantization (signal);Entropy coding;Decoding","audio coding;data compression;discrete cosine transforms;frequency-domain analysis;singular value decomposition;virtual reality","frequency domain singular value decomposition;efficient spatial audio coding;virtual reality;higher order ambisonics representation;rendering flexibility;HOA compression;HOA data;principal components;standard audio coding;frequency domain quantization;entropy coding;psychoacoustic redundancy;occasional mismatch;audio coder;smooth transition;frequency dependent SVD;suppressed ambient energy;discarded higher order ambisonics channels;reconstructed HOA signal;objective evaluation results;subjective evaluation results;higher compression gains;standardization;modified discrete cosine transform;suboptimal transitions;MDCT;energy compaction;noise substitution technique;perceptual quality","","1","","13","","11 Dec 2017","","","IEEE","IEEE Conferences"
"A 130dB PSRR, 108dB DR and 95dB SNDR, ground-referenced audio decoder with PSRR-enhanced load-adaptive Class-G 16Ohm headphone amplifiers","S. Wen; C. Chen; C. Yang; C. Chen; J. Jiang; K. Hsiao; C. Chien","MediaTek Inc. Hsin-Chu, Taiwan; MediaTek Inc. Hsin-Chu, Taiwan; MediaTek Inc. Hsin-Chu, Taiwan; MediaTek Inc. Hsin-Chu, Taiwan; MediaTek Inc. Hsin-Chu, Taiwan; MediaTek Inc. Hsin-Chu, Taiwan; MediaTek Inc. Hsin-Chu, Taiwan","2015 IEEE Asian Solid-State Circuits Conference (A-SSCC)","21 Jan 2016","2015","","","1","4","A Class-G headphone amplifier for Hi-Fi audio playback with high immunity to supply disturbance and Class-G switching noise is presented that achieves 130dB PSRR at 217Hz and higher than 100dB PSRR up to 20kHz. In addition, a Class-G amplifier with load-adaptive voltage supply rails selection and Class-G switching scheme improves the power efficiency for different impedances. Realized in 0.18μm CMOS, the decoder and amplifier together achieve 108dB DR and 95dB SNDR with a 16D headphone load.","","978-1-4673-7191-9","10.1109/ASSCC.2015.7387442","","https://ieeexplore.ieee.org/stamp/stamp.jsp?arnumber=7387442","Class-G;Audio amplifier;PSRR-enhancement;Power efficiency;Load-adaptive;Charge-pump","Impedance;Headphones;Charge pumps;Switches;Decoding;Rails;Detectors","audio coding;audio-frequency amplifiers;CMOS analogue integrated circuits;decoding;headphones;Hi-Fi equipment","PSRR;SNDR;ground-referenced audio decoder;PSRR-enhanced load-adaptive class-G headphone amplifiers;Hi-Fi audio playback;class-G switching noise;load-adaptive voltage supply rails selection;power efficiency;CMOS process;resistance 16 ohm;frequency 217 Hz;size 0.18 mum","","1","1","3","","21 Jan 2016","","","IEEE","IEEE Conferences"
"Audio Watermarking Based on Amplitude Variation to Enhance Imperceptibility and Robustness of an Audio Signal","M. K. Pandey; G. Parmar; R. Gupta","Deptt. of Electron. Eng., Rajasthan Tech. Univ., Kota, India; Deptt. of Electron. Eng., Rajasthan Tech. Univ., Kota, India; Deptt. of Electron. Eng., Rajasthan Tech. Univ., Kota, India","2015 Fifth International Conference on Communication Systems and Network Technologies","1 Oct 2015","2015","","","657","661","In recent years, proliferation of digital multimedia including images, audio, video and documents become popular due to on line distribution of digital multimedia. In such an open environment, it is convenient to get the access to various information sources. This increases the possibility of large-scale unauthorized copying of digital data. These concerns over protecting copyright have triggered significant research to find ways to hide copyright messages and serial number into digital media. In this paper, to enhance imperceptibility and robustness of an audio signal, we propose a robust audio watermarking technique based on pseudo-random gray sequences that embed multi bits within an audio signal. Proposed audio watermarking algorithm aims to satisfy and maximize both imperceptibility and robustness of the watermark by embedding 1023 bits within a sample of an audio signal. Proposed technique relies on basic principle that on varying the amplitude of the host signal by a few percent produces inaudible variations resulting in a watermarked signal which sounds identical to the original host file. The imperceptibility and the robustness of watermarking based on amplitude variation of host signal according to PN gray sequence is tested using various attacks.","","978-1-4799-1797-6","10.1109/CSNT.2015.196","","https://ieeexplore.ieee.org/stamp/stamp.jsp?arnumber=7280000","Audio Watermarking;PN Gray Sequene;Amplitude Variation","Watermarking;Robustness;Signal to noise ratio;Conferences;Multimedia communication;Decoding;Noise measurement","audio watermarking;copy protection;random sequences","audio watermarking;amplitude variation;imperceptibility;audio signal;digital multimedia;online distribution;open environment;information sources;large-scale unauthorized copying;digital data;copyright protection;copyright messages;serial number;digital media;pseudorandom gray sequences;host signal;watermarked signal;PN gray sequence","","","","26","","1 Oct 2015","","","IEEE","IEEE Conferences"
"High-performance audio matching with features learned by convolutional deep belief network","W. Feng; N. Guan; Z. Luo","Institute of Software, College of Computer National University of Defense Technology, Changsha, Hunan, P.R. China, 410073; Institute of Software, College of Computer National University of Defense Technology, Changsha, Hunan, P.R. China, 410073; Institute of Software, College of Computer National University of Defense Technology, Changsha, Hunan, P.R. China, 410073","2016 IEEE 13th International Conference on Signal Processing (ICSP)","16 Mar 2017","2016","","","1724","1728","Audio matching automatically retrieves all excerpts that have the same content as the query audio clip from given audio recordings. The extracted feature is critical for audio matching and the Chroma Energy Normalized Statistics (CENS) feature is the state-of-the-arts. However, CENS might behave unsatisfactorily on some audio because it is a handcraft feature. In this paper, we propose to utilize the features learned by Convolutional Deep Belief Network (CDBN) to enhance the performance of audio matching. Benefit from the strong generalization ability of CDBN, our method works better than CENS based methods on most audio datasets. Since the features learned by CDBN are binary-valued, we can develop a more efficient audio matching algorithm by taking the advantage of this property. Experimental results on both TIMIT dataset and a simulated music dataset confirm effectiveness of the proposed CDBN based method comparing with the traditional CENS feature based algorithm.","2164-5221","978-1-5090-1345-6","10.1109/ICSP.2016.7878122","","https://ieeexplore.ieee.org/stamp/stamp.jsp?arnumber=7878122","audio matching;convolutional deep belief network;content-based audio retrieval","Feature extraction;Convolution;Detectors;Audio recording;Audio databases;Spectrogram;Signal processing algorithms","audio recording;audio signal processing;belief networks;statistical analysis","high-performance audio matching algorithm;convolutional deep belief network;query audio clip;audio recordings;chroma energy normalized statistics;CENS;handcraft feature;CDBN;audio dataset;TIMIT dataset;simulated music dataset","","1","","13","","16 Mar 2017","","","IEEE","IEEE Conferences"
"Audio Word2vec: Sequence-to-Sequence Autoencoding for Unsupervised Learning of Audio Segmentation and Representation","Y. Chen; S. Huang; H. Lee; Y. Wang; C. Shen","Graduate Institute of Communication Engineering, National Taiwan University, Taipei, Taiwan; Graduate Institute of Communication Engineering, National Taiwan University, Taipei, Taiwan; Department of Electrical Engineering, National Taiwan University, Taipei, Taiwan; Carnegie Mellon University, Language Technologies Institute, Pittsburgh, PA, USA; CompStak, New York, NY, USA","IEEE/ACM Transactions on Audio, Speech, and Language Processing","28 Jun 2019","2019","27","9","1481","1493","In text, word2vec transforms each word into a fixed-size vector used as the basic component in applications of natural language processing. Given a large collection of unannotated audio, audio word2vec can also be trained in an unsupervised way using a sequence-to-sequence autoencoder (SA). These vector representations are shown to effectively describe the sequential phonetic structures of the audio segments. In this paper, we further extend this research in the following two directions. First, we disentangle phonetic information and speaker information from the SA vector representations. Second, we extend audio word2vec from the word level to the utterance level by proposing a new segmental audio word2vec in which unsupervised spoken word boundary segmentation and audio word2vec are jointly learned and mutually enhanced, and utterances are directly represented as sequences of vectors carrying phonetic information. This is achieved by means of a segmental sequence-to-sequence autoencoder, in which a segmentation gate trained with reinforcement learning is inserted in the encoder.","2329-9304","","10.1109/TASLP.2019.2922832","Ministry of Science and Technology, Taiwan; ","https://ieeexplore.ieee.org/stamp/stamp.jsp?arnumber=8736337","Audio word2Vec;sequence-to-sequence autoencoder","Phonetics;Speech recognition;Acoustics;Decoding;Training;Task analysis;Recurrent neural networks","audio signal processing;natural language processing;signal representation;speech processing;unsupervised learning","reinforcement learning;natural language processing;SA vector representations;phonetic information;speaker information;unsupervised spoken word boundary segmentation;segmental audio word2vec;word level;unannotated audio word2vec;audio segmentation;sequence-to-sequence autoencoding","","7","","80","IEEE","13 Jun 2019","","","IEEE","IEEE Journals"
"IEEE Draft Standard for Advanced Audio Coding","",,"IEEE P1857.2/D3, May 2013","15 May 2013","2012","","","1","356","This standard defines a set of tools to support specific audio coding functions including general audio coding and lossless audio coding. The tool set defined in this standard, in combination provides regular high quality and efficient coding tool sets for compression, decompression, processing, and representing of audio data to save bandwidth for transmission, to save space for storage, to speed up indexing and multimedia search, and to enhance performance when using mixed media for virtual reality and other applications that demand high bandwidth. The target applications and services include but not limited audio transmission, audio recording, internet streaming, and other video/audio enabled services and applications.","","978-0-7381-8443-2","","","https://ieeexplore.ieee.org/stamp/stamp.jsp?arnumber=6516510","audio coding;scalable coding;lossless coding;LPC;vector quantization;bit-plane coding;PQ-SPSC;entropy coding","IEEE standards;Audio coding;Loss measurement;Vector quantization;Entropy coding","","","","","","","","15 May 2013","","","IEEE","IEEE Standards"
"Fast Conversion Algorithm for the Dolby Digital (Plus) AC-3 Audio Coding Standards","V. Britanak","Institute of Informatics, Slovak Academy of Sciences, Bratislava, Slovak republic","IEEE Signal Processing Letters","15 Nov 2012","2012","19","12","910","913","The Dolby Digital (AC-3) and the Dolby Digital Plus or Enhanced AC-3 (E-AC-3) systems are currently the key enabling technologies for high-quality compression of digital audio signals. For the time-to-frequency transformation of an audio data block and vice versa, both systems have adopted a long transform being the modified discrete cosine transform (MDCT). The AC-3 additionally defines two variants of cosine-modulated filter banks called the first and second short transforms. A fast conversion algorithm is presented to convert the frequency coefficients of the long (MDCT) transform to those of two short transforms and vice versa, directly in the frequency domain. It is based on a block sparse matrix factorization of a conversion matrix. The fast conversion algorithm is efficient in terms of the structural simplicity, arithmetic complexity and memory requirements compared to the obvious conversion methods. Moreover, the existing AC-3 fast computational modules may be simply re-used in the conversion procedures. Consequently, the E-AC-3 to AC-3 bit stream conversion and the AC-3 to E-AC-3 bit stream transcoding can be realized in a simplified and efficient way, thus minimizing the amount of partial decoding/encoding and memory requirements during the conversion and transcoding processes.","1558-2361","","10.1109/LSP.2012.2226028","","https://ieeexplore.ieee.org/stamp/stamp.jsp?arnumber=6336787","AC-3 analysis/synthesis filter banks;AC-3 to E-AC-3 transcoder;block sparse matrix factorization;dolby digital (AC-3);dolby digital plus or enhanced AC-3 (E-AC-3);E-AC-3 to AC-3 conversion;fast conversion algorithm","Transforms;Sparse matrices;Matrix converters;Standards;Frequency conversion;Transcoding;Filter banks;Audio coding","audio coding;decoding;discrete cosine transforms;matrix decomposition;sparse matrices;time-frequency analysis","Dolby digital plus AC-3 audio coding standards;enhanced AC-3 systems;high-quality compression;digital audio signals;time-to-frequency transformation;audio data block;modified discrete cosine transform;MDCT;block sparse matrix factorization;conversion matrix;structural simplicity;arithmetic complexity;memory requirements;fast computational modules;bit stream conversion;E-AC-3 bit stream transcoding;partial decoding-encoding","","1","","10","","22 Oct 2012","","","IEEE","IEEE Journals"
"An improved audio fingerprinting algorithm with robust and efficient","Wei Xiong; Xiaoqing Yu; Jianhua Shi","School of Communication and Information Engineering, Shanghai University, China; School of Communication and Information Engineering, Shanghai University, China; School of Communication and Information Engineering, Shanghai University, China","IET International Conference on Smart and Sustainable City 2013 (ICSSC 2013)","13 Feb 2014","2013","","","377","380","An audio fingerprint is a content-based compact feature that summarizes an audio clip. As same as we using human fingerprint to recognize people, audio fingerprint can be used to retrieval unknown audio clips. In this paper, we propose an algorithm which extracts audio fingerprint based on spectral bark-band energy and PCA (Principle Components Analysis). By using this algorithm, search a huge audio database efficient and highly robust in the presence of noise be possible. Especially, the algorithm enhances the efficiency to a higher level. The preliminary result of our experiments shows prominent performance.","","978-1-84919-707-6","10.1049/cp.2013.1960","","https://ieeexplore.ieee.org/stamp/stamp.jsp?arnumber=6737837","Audio Fingerprint;Robust;Efficient;PCA;Content-Based Retrieval","","audio signal processing;principal component analysis","audio fingerprinting algorithm;content-based compact feature;human fingerprint;people recognition;unknown audio clip retrieval;spectral bark-band energy;principle components analysis;PCA;huge audio database","","","","","","13 Feb 2014","","","IET","IET Conferences"
"An enhanced least significant bit modification technique for audio steganography","M. Asad; J. Gilani; A. Khalid","Telecommunication Engineering Department, University of Engineering and Technology Taxila, UET, Taxila-47050, Rawalpindi, Pakistan; Telecommunication Engineering Department, University of Engineering and Technology Taxila, UET, Taxila-47050, Rawalpindi, Pakistan; Telecommunication Engineering Department, University of Engineering and Technology Taxila, UET, Taxila-47050, Rawalpindi, Pakistan","International Conference on Computer Networks and Information Technology","15 Sep 2011","2011","","","143","147","Increased use of electronic communication has given birth to new ways of transmitting information securely. Audio steganography is the science of hiding some secret text or audio information in a host message. The host message before steganography and stego message after steganography have the same characteristics. Least Significant Bit (LSB) modification technique is the most simple and efficient technique used for audio steganography. The conventional LSB modification technique is vulnerable to steganalysis. This paper proposes two ways to improve the conventional LSB modification technique. The first way is to randomize bit number of host message used for embedding secret message while the second way is to randomize sample number containing next secret message bit. The improvised proposed technique works against steganalysis and decreases the probability of secret message being extracted by an intruder. Advanced Encryption Standard (AES) with 256 bits key length is used to secure secret message in case the steganography technique breaks. Proposed technique has been tested successfully on a. wav file at a sampling frequency of 8000 samples/second with each sample containing 8 bits.","2223-6317","978-1-61284-941-6","10.1109/ICCNIT.2011.6020921","","https://ieeexplore.ieee.org/stamp/stamp.jsp?arnumber=6020921","Steganography;Audio Steganography;Steganalysis;LSB Modification Steganography;Information Security;Secret Information Transmission;AES-256","Encryption;Communications technology","audio coding;steganography","enhanced least significant bit modification technique;audio steganography;electronic communication;secret text;secret audio information;stego message;secret message bit;advanced encryption standard","","32","","5","","15 Sep 2011","","","IEEE","IEEE Conferences"
"Representation of spectral envelope with warped frequency resolution for audio coder","R. Sugiura; Y. Kamamoto; N. Harada; H. Kameoka; T. Moriya","Graduate School of Information Science and Technology, The University of Tokyo, Japan; NTT Communication Science Labs., Nippon Telegraph and Telephone Corp., Japan; NTT Communication Science Labs., Nippon Telegraph and Telephone Corp., Japan; NTT Communication Science Labs., Nippon Telegraph and Telephone Corp., Japan; NTT Communication Science Labs., Nippon Telegraph and Telephone Corp., Japan","2014 22nd European Signal Processing Conference (EUSIPCO)","13 Nov 2014","2014","","","51","55","We have devised a method for representing frequency spectral envelopes with warped frequency resolution based on sparse non-negative matrices aiming at its use for frequency domain audio coding. With optimally prepared matrices, we can selectively control the resolution of spectral envelopes and enhance the coding efficiency. We show that the devised method can enhance the subjective quality of the state-of-the-art wide-band coder at 16 kbit/s at a cost of minor additional complexity. The method is therefore, expected to be useful for low-bit-rate and low-delay audio coder for mobile communications.","2076-1465","978-0-9928-6261-9","","","https://ieeexplore.ieee.org/stamp/stamp.jsp?arnumber=6951969","audio coding;signal processing;frequency warping;non-negative matrix;TCX","Speech;Frequency-domain analysis;Speech coding;Quantization (signal);Audio coding;Sparse matrices","audio coding;frequency-domain analysis;sparse matrices","spectral envelope representation;warped frequency resolution;sparse nonnegative matrices;frequency domain audio coding;coding efficiency enhancement;wideband coder;low-bit-rate audio coder;low-delay audio coder;mobile communications","","","","11","","13 Nov 2014","","","IEEE","IEEE Conferences"
